{
  "run_id": "20261009T101500Z-s42",
  "seed": 42,
  "model_sha256": "0000000000000000000000000000000000000000000000000000000000000000",
  "config": {
    "steps_per_repeat": 100000,
    "repeats": 7,
    "warmup_repeats": 1,
    "timesteps_s": [
      0.002
    ],
    "scenarios": [
      "constant"
    ],
    "policy_hold_steps": 16
  },
  "results": [
    {
      "scenario": "constant",
      "timestep_s": 0.002,
      "steps_per_second": {
        "median": 1.0,
        "mean": 1.01,
        "min": 0.9,
        "max": 1.1,
        "stdev": 0.07,
        "cv": 0.07
      },
      "repeat_values": [
        1.0,
        1.1,
        0.9,
        1.0,
        1.05
      ],
      "nan_inf_count": 0
    }
  ],
  "peak_ram_mb": 300.0,
  "gpu": {
    "available": true,
    "name": "gpu-ghi-tu-dong",
    "total_mb": 8000.0,
    "peak_allocated_mb": 16.0,
    "tensor_op_ok": true,
    "reason": null
  },
  "libraries": {
    "mujoco": "3.15.0",
    "myo-sim": "0.2.3",
    "numpy": "2.5.3"
  }
}
